target_name,gene,description,KOG,remarks,Mountain,fL3s446,eL3s82,FC,fL3s364,eL3s125,FC.1,fL4s660,eL4s408,FC.2,fL4s1165,eL4s377,FC.3,fADs1711,eADs213,FC.4,fADs547,eADs598,FC.5,fL3m1612,eL3m951,FC.6,fL3m4134,eL3m1037,FC.7,fL4m1857,eL4m1318,FC.8,fL4m3713,eL4m3494,FC.9,fADm2498,eADm2449,FC.10,fADm2040,eADm2527,FC.11,fADm981,eADm599,FC.12,fADm631,eADm765,FC.13,Input,Suggested Match,History
K01C8.9,nst-1,"nst-1 encodes a homolog of human GNL3 (<a href=""http://www.ncbi.nlm.nih.gov/entrez/dispomim.cgi?id=608011"">OMIM:608011</a>, nucleostemin) and GNL3L, and of S. cerevisiae NUG1; NST-1 may suppress tumorous growth in the germ line by ensuring robust larval germline proliferation; like PRO-1, -2, and -3, NST-1 is probably required for ribosome biogenesis, suggesting a link between biogenesis in the distal sheath and control of cell division in the germ line; nucleostemin is a nucleolar protein found in stem cells that is required in quantitatively correct amounts (neither too little nor too much) for continued cell division and survival by stem cells or transformed cells; NST-1 is required in mass RNAi assays for normally rapid growth, larval viability, and normal body morphology and pigmentation. ",GTPase ,sRNA_DOWN in ego-1_AND_mRNA_inconsistent,Mountain ,19,0,4.45,22,1,4.37,35,1,11.36,51,1,8.74,82,3,25.77,22,0,25.03,177,112,0.94,819,287,0.73,342,256,0.95,1112,776,1.35,641,732,0.86,543,848,0.79,356,139,1.58,246,279,1.06,K01C8.9,WBGene00003821,Sequence name for WBGene00003821(nst-1). History: N.A.
K01G5.5,K01G5.5,"The K01G5.5 gene encodes an ortholog of human DYSKERIN (DKC1; <a href=""http://www.ncbi.nlm.nih.gov/entrez/dispomim.cgi?id=300126"">OMIM:300126</a>), which when mutated leads to X-linked dyskeratosis congenita (OMIM:305000); the K01G5.5 protein is predicted to be mitochondrial with 68% accuracy. ",Pseudouridine synthase ,sRNA_DOWN in ego-1_AND_mRNA_inconsistent,Mountain 20,55,2,4.15,45,5,2.91,81,5,8.62,92,3,7.82,134,4,33.53,44,1,24.49,1626,598,1.62,1400,500,0.71,736,715,0.73,1412,3039,0.44,1871,1561,1.18,1482,1481,1.24,1000,418,1.48,416,647,0.78,K01G5.5,WBGene00010478,Public name for WBGene00010478. History: N.A.
K01G5.7,tbb-1,"This gene encodes a homolog of mammalian beta-tubulin (TUBB) that is expressed at high levels in the germline; TBB-1 is redundant for embryonic viability, due to its paralog TBB-2. ",Beta tubulin ,sRNA_DOWN in ego-1_AND_mRNA_UP in ego-1,Mountain 20,33,0,7.57,29,6,1.63,84,3,13.41,152,5,8.57,192,4,47.94,107,5,19.59,318,257,0.74,924,316,0.74,412,538,0.55,677,992,0.64,1065,1786,0.58,876,1925,0.56,323,397,0.5,355,468,0.92,K01G5.7,WBGene00006536,Sequence name for WBGene00006536(tbb-1). History: N.A.
K02F2.1b,dpf-3,,Dipeptidyl aminopeptidases/acylaminoacyl-peptidases ,sRNA_DOWN in ego-1_AND_mRNA_inconsistent,Mountain 2,33,4,1.51,24,1,4.75,50,9,3.22,61,2,6.95,80,3,25.15,28,7,3.95,85,137,0.37,324,95,0.86,185,115,1.14,556,392,1.33,477,771,0.61,402,854,0.58,195,102,1.18,148,162,1.1,K02F2.1b,WBGene00001056,Molecule name for WBGene00001056(dpf-3). History: N.A.
K02F2.3,tag-203,,"Splicing factor 3b, subunit 3 ",sRNA_DOWN in ego-1_AND_mRNA_inconsistent,Mountain 5,45,9,1.02,38,7,1.85,85,14,3.62,160,0,54.13,240,4,59.86,67,0,74.01,240,253,0.57,494,106,1.18,244,180,0.97,518,406,1.2,465,596,0.77,377,578,0.81,128,70,1.12,101,112,1.09,K02F2.3,WBGene00019323,Sequence name for WBGene00019323(teg-4). History: Renamed on 2005-03-17; Renamed on 2010-02-19; Renamed on 2015-03-02
K02F2.4,ulp-5,,"Protease, Ulp1 family ",sRNA_DOWN in ego-1_AND_mRNA_inconsistent,Mountain 7,64,8,1.61,43,6,2.39,57,9,3.66,151,2,17.04,113,2,47.19,45,0,50.06,4,0,2.98,8,8,0.25,0,11,0.06,23,51,0.43,25,151,0.17,11,140,0.11,5,17,0.21,7,18,0.51,K02F2.4,WBGene00006740,Sequence name for WBGene00006740(ulp-5). History: Renamed on 2014-03-28; Renamed on 2014-09-02
K03D10.1,kal-1,"kal-1 encodes a cell surface protein that contains a WAP-type protease inhibitor domain and Type III fibronectin domains and is the C. elegans ortholog of human KAL-1, mutated in the X-linked form of the neurological disorder Kallmann syndrome; in C. elegans, both kal-1 loss-of-function mutations and kal-1 overexpression result in similar phenotypes that indicate KAL-1 activity is required for epithelial morphogenesis and axon branching; kal-1 transcriptional reporters reveal expression beginning in the 50-cell stage embryo in 2-3 cells with later embryonic expression in at least 8-10 AB-derived ventral neuroblasts that are a substrate for migrating epidermal cells during ventral enclosure; later expression in larvae and adults is restricted to anterior neurons, including AIY, AIZ, RID, M5, ASI, and labial sensory neurons, ventral nerve cord motorneurons, midbody neurons HSN, CAN, and PVM, tail neurons DVB, DVC, and PDB, and the nonneuronal excretory cell as well as in uterine muscles; in the AIY interneurons, kal-1 is part of a gene battery whose expression is under the control of the CEH-10 and TTX-3 Paired and LIM-type homeodomains, respectively. ",Adhesion-type protein ,sRNA_DOWN in ego-1_AND_mRNA_inconsistent,Mountain 1,51,9,1.16,39,8,1.69,83,11,4.42,332,3,27.99,97,2,40.57,48,0,53.33,4,20,0.14,21,12,0.43,19,9,1.43,31,20,1.43,4,8,0.54,4,14,0.41,4,0,3.09,2,0,3.62,K03D10.1,WBGene00002181,Sequence name for WBGene00002181(kal-1). History: N.A.
K03H1.2,mog-1,"The mog-1 gene encodes a DEAH helicase orthologous to the Drosophila CG1375/1405, the human PRP16, and the S. cerevisiae PRP16 proteins. ",mRNA splicing factor ATP-dependent RNA helicase ,sRNA_DOWN in ego-1_AND_mRNA_inconsistent,Mountain ,38,7,1.09,57,2,7.34,69,8,4.91,182,7,7.69,169,37,5.56,112,5,20.5,227,133,1.01,584,123,1.2,257,201,0.91,559,966,0.55,907,902,0.99,721,991,0.9,385,434,0.55,218,585,0.45,K03H1.2,WBGene00003389,Sequence name for WBGene00003389(mog-1). History: N.A.
K04C2.2,K04C2.2,,Predicted regulator of rRNA gene transcription (MYB-binding protein) ,sRNA_DOWN in ego-1_AND_mRNA_inconsistent,Mountain 16,23,4,1.07,36,5,2.34,28,3,4.58,77,1,13.11,77,2,32.29,27,3,7.62,551,368,0.89,467,196,0.61,398,201,1.41,600,687,0.82,757,380,1.95,625,416,1.86,349,242,0.89,141,247,0.69,K04C2.2,WBGene00019380,Public name for WBGene00019380. History: N.A.
K04C2.4,brd-1,"brd-1 encodes an ortholog of the BRCA1-associating protein BARD1 (<a href=""http://www.ncbi.nlm.nih.gov/entrez/dispomim.cgi?id=601593"">OMIM:601593</a>), associated with susceptibility to breast cancer; BRD-1 forms a heterodimer with BRC-1, which constitutes an E3 ubiquitin ligase; after irradiation, the DNA checkpoint proteins ATL-1 and MRE-11 are required for BRC-1/BRD-1 heterodimers to associate with the E2 ubiqutin-conjugating enzyme LET-70/Ubc5 and with RAD-51, and to ubiquitylate damaged chromatin; BRD-1 and BRC-1 bind one another, probably through their N-terminal RING domains, in yeast two-hybrid experiments and pull-down assays; BRC-1/BRD-1 heterodimers may interact with RAD-51 and other proteins via mutual binding to UBC-9; brd-1(RNAi) animals have excess chromosomal nondisjunction, abnormally high levels of CEP-1-dependent germ cell apoptosis (both with and without gamma-irradiation) and hypersensitivity to gamma-irradiation (e.g., abnormal sterility after irradiation); BRD-1 autoubiquitylation probably activates the BRC-1/BRD-1 heterodimer; BRD-1 binds SMT-3 (a Sumo homolog) and TAC-1; brd-1 is genetically dispensable for the induction of nuclear ATL-1 foci by gamma-irradiation or hydroxyurea. ",,sRNA_inconsistent_AND_mRNA_inconsistent,Mountain 11,14,3,0.83,13,1,2.66,40,4,5.17,45,1,7.73,62,1,39.12,41,0,45.71,0,0,0.6,33,15,0.54,65,26,1.74,124,163,0.72,142,258,0.54,123,274,0.56,85,43,1.21,41,74,0.68,K04C2.4,WBGene00000265,Sequence name for WBGene00000265(brd-1). History: N.A.
K04D7.1,rack-1,,G protein beta subunit-like protein ,sRNA_DOWN in ego-1_AND_mRNA_inconsistent,Mountain 23,11,0,2.67,15,2,2.03,44,2,9.47,52,3,4.46,95,13,8.52,43,9,4.79,2682,1010,1.58,10669,1928,1.41,2330,2139,0.78,6286,4364,1.36,2110,1511,1.37,1682,1614,1.29,1355,289,2.89,702,475,1.78,K04D7.1,WBGene00010556,Sequence name for WBGene00010556(rack-1). History: N.A.
K04G2.1,iftb-1,"iftb-1 encodes the C. elegans ortholog of translation initiation factor 2 beta (eIF2beta); by homology, IFTB-1 is predicted to function in translation initiation and start codon recognition; loss of iftb-1 via RNAi indicates that iftb-1 activity is required for a number of processes including growth, development, and body morphogenesis; loss of iftb-1 activity in adult animals extends lifespan. ","Translation initiation factor 2, beta subunit (eIF-2beta) ",sRNA_DOWN in ego-1_AND_mRNA_DOWN in ego-1,,25,0,5.79,25,1,4.94,45,2,9.68,60,1,10.26,70,0,88.18,14,0,16.33,377,220,1.02,848,136,1.58,216,149,1.03,733,662,1.04,596,541,1.08,486,587,1.02,252,102,1.52,168,130,1.56,K04G2.1,WBGene00010560,Sequence name for WBGene00010560(eif-2beta). History: Renamed on 2017-01-09
K04G2.2,K04G2.2,,Predicted alpha/beta hydrolase ,sRNA_DOWN in ego-1_AND_mRNA_inconsistent,Mountain 11,44,5,1.67,30,10,1.07,61,8,4.35,130,10,4.0,246,3,76.69,30,0,33.74,12,0,7.74,32,22,0.37,18,25,0.52,116,91,1.2,107,230,0.46,83,239,0.43,55,46,0.74,46,63,0.89,K04G2.2,WBGene00045192,"Sequence name for WBGene00045192(aho-3). History: N.A.. Public name for Dead gene WBGene00010561. History of WBGene00010561: Merged into ""WBGene00045192"" on 2012-04-27"
K04G7.10,rnp-7,,U1 small nuclear ribonucleoprotein (RRM superfamily) ,sRNA_DOWN in ego-1_AND_mRNA_inconsistent,Mountain 5,19,0,4.45,23,5,1.52,34,2,7.36,111,6,5.38,106,19,6.64,43,1,23.94,199,39,2.98,624,73,2.15,136,84,1.15,289,442,0.62,304,233,1.28,194,190,1.26,139,59,1.44,91,108,1.02,K04G7.10,WBGene00004390,Sequence name for WBGene00004390(rnp-7). History: N.A.
K04G7.11,K04G7.11,,,sRNA_DOWN in ego-1_AND_mRNA_inconsistent,Mountain 5,14,0,3.34,12,1,2.47,38,1,12.31,78,0,26.56,69,1,43.47,33,0,37.0,6,0,4.17,95,38,0.63,21,26,0.58,205,79,2.42,182,390,0.46,158,449,0.44,117,98,0.74,59,51,1.39,K04G7.11,WBGene00019402,Sequence name for WBGene00019402(syf-2). History: N.A.
K04G7.4b,nuo-4,,"NADH:ubiquinone oxidoreductase, NDUFA10/42kDa subunit ",sRNA_DOWN in ego-1_AND_mRNA_inconsistent,Mountain 2,48,5,1.82,39,12,1.17,51,4,6.56,171,1,28.92,100,0,125.44,38,0,42.45,254,71,2.11,1219,273,1.13,417,237,1.25,1341,557,2.26,414,506,0.8,339,492,0.85,351,106,2.03,195,243,0.97,K04G7.4b,WBGene00019401,Molecule name for WBGene00019401(nuo-4). History: N.A.
K05C4.1,pbs-5,,"20S proteasome, regulatory subunit beta type PSMB5/PSMB8/PRE2 ",sRNA_DOWN in ego-1_AND_mRNA_inconsistent,Mountain 2,16,0,3.78,7,2,1.01,31,0,20.19,55,0,18.83,72,2,30.22,28,1,15.78,213,197,0.64,860,133,1.64,350,247,1.01,457,988,0.44,657,572,1.13,532,616,1.07,189,163,0.72,126,233,0.65,K05C4.1,WBGene00003951,Sequence name for WBGene00003951(pbs-5). History: N.A.
K05C4.6,hmp-2,"hmp-2 encodes a beta-catenin; HMP-2 activity is required during embryonic development for cell adhesion at adherens junctions, cell migration, and body morphogenesis; as a beta-catenin, HMP-2 likely functions solely as part of a cadherin-catenin complex, as in yeast two-hybrid assays, HMP-2 is the only C. elegans beta-catenin that binds HMP-1/alpha-catenin and HMR-1/cadherin; additionally, in the embryo, HMP-2 co-localizes to sites of epithelial cell contacts with HMP-1 and HMR-1/cadherin; however, despite its normal role in embryonic cell adhesion, HMP-2 can activate transcription and when overexpressed in vivo, can partially rescue vulval defects produced by loss of BAR-1/beta-catenin, suggesting that HMP-2 has retained the ability to interact with the Wnt signaling pathway. ",Armadillo/beta-Catenin/plakoglobin ,sRNA_DOWN in ego-1_AND_mRNA_inconsistent,Mountain 2,55,9,1.25,29,5,1.9,33,4,4.29,78,5,4.43,100,0,125.44,46,0,51.15,83,16,2.94,167,58,0.73,159,67,1.68,99,187,0.5,244,230,1.04,228,256,1.1,65,58,0.69,79,61,1.56,K05C4.6,WBGene00001979,Sequence name for WBGene00001979(hmp-2). History: Renamed on 2011-04-19
K07A1.11,rba-1,,"Nucleosome remodeling factor, subunit CAF1/NURF55/MSI1 ",sRNA_DOWN in ego-1_AND_mRNA_inconsistent,Mountain 2,16,0,3.78,19,0,7.6,32,0,20.83,46,1,7.9,91,1,57.13,26,0,29.39,28,0,17.27,104,17,1.49,64,32,1.4,115,119,0.91,248,234,1.04,221,269,1.02,66,26,1.53,70,63,1.34,K07A1.11,WBGene00004312,Sequence name for WBGene00004312(rba-1). History: N.A.
K07A12.2,K07A12.2,,Leucine rich repeat ,sRNA_DOWN in ego-1_AND_mRNA_inconsistent,Mountain 7,180,11,3.36,174,21,3.02,456,27,10.3,1311,8,49.02,685,8,94.66,377,13,29.39,23,0,14.29,82,57,0.36,93,78,0.85,184,228,0.76,585,2017,0.28,456,2140,0.26,142,365,0.24,174,491,0.43,K07A12.2,WBGene00010621,Sequence name for WBGene00010621(egg-6). History: N.A.
K07A12.7,K07A12.7,,Mitochondrial/choloroplast ribosomal protein S15 ,sRNA_DOWN in ego-1_AND_mRNA_inconsistent,,9,0,2.23,7,1,1.52,26,0,17.04,30,0,10.42,39,1,24.84,20,0,22.86,35,0,21.44,246,38,1.61,63,56,0.8,193,111,1.63,89,92,0.95,82,84,1.21,84,8,5.84,33,14,2.73,K07A12.7,WBGene00010624,Sequence name for WBGene00010624(mrps-15). History: N.A.
K07C5.4,K07C5.4,,Ribosome biogenesis protein - Nop56p/Sik1p ,sRNA_inconsistent_AND_mRNA_inconsistent,Mountain 20,41,20,0.45,23,4,1.82,53,9,3.41,136,0,46.07,101,7,15.83,69,0,76.19,1258,797,0.94,796,480,0.42,547,420,0.93,1175,1454,0.76,620,711,0.86,506,773,0.81,422,270,0.97,201,237,1.02,K07C5.4,WBGene00010627,Sequence name for WBGene00010627(nol-56). History: N.A.
K07C5.6,K07C5.6,,RNA splicing factor - Slu7p ,sRNA_DOWN in ego-1_AND_mRNA_inconsistent,Mountain 11,26,2,2.0,18,3,1.8,47,5,5.05,40,1,6.89,82,12,7.93,29,9,3.27,98,100,0.58,381,63,1.52,190,134,1.01,500,547,0.86,922,818,1.11,732,866,1.05,530,293,1.12,252,296,1.03,K07C5.6,WBGene00010629,Sequence name for WBGene00010629(sluh-7). History: N.A.
K07C5.8,cash-1,"cash-1 encodes an ortholog of Drosophila CKA and the human striatins STRN, STRN3, and STRN4 that is required for vulval development; CASH-1 has an N-terminal region which may bind caveolin or calmodulin, and a C-terminal region with five tandem WD domains; by its orthology with CKA and striatins, CASH-1 is predicted to act as a scaffold linking signal transduction proteins (such as JKK-1 and JNK-1) to transcription factors (such as JUN-1 or FOS-1); CASH-1 is expressed broadly, in both larval and adult pharynx, intestine, rectal epithelium, hypodermis, and neurons, as well as the developing vulva and the adult reproductive system. ","Cell-cycle nuclear protein, contains WD-40 repeats ",sRNA_DOWN in ego-1_AND_mRNA_inconsistent,,39,2,2.97,35,2,4.56,48,9,3.09,109,9,3.7,182,18,11.96,50,1,27.75,71,0,42.87,316,91,0.88,112,106,0.75,467,268,1.64,406,632,0.63,343,666,0.64,152,96,0.98,106,153,0.84,K07C5.8,WBGene00010631,Sequence name for WBGene00010631(cash-1). History: N.A.
K07D4.2,K07D4.2,,Uncharacterized conserved protein ,sRNA_inconsistent_AND_mRNA_inconsistent,Mountain 0,8,0,2.0,4,5,0.32,11,26,0.28,7,128,0.02,12,862,0.02,31,612,0.06,0,0,0.6,0,0,0.25,0,0,0.71,0,0,0.94,0,2,0.33,0,0,1.24,0,1,0.31,0,1,0.6,K07D4.2,WBGene00019483,Public name for WBGene00019483. History: N.A.
K07D4.3,rpn-11,"rpn-11 encodes a predicted non-ATPase subunit of the 19S regulatory complex of the proteasome that affects adult viability, osmoregulation, embryonic viability, and movement; interacts with itself, RPN-9, and F55A11.3, based on yeast two-hybrid assays. ","26S proteasome regulatory complex, subunit RPN11 ",sRNA_inconsistent_AND_mRNA_inconsistent,Mountain 20,7,2,0.59,24,2,3.16,58,2,12.41,49,0,16.81,78,0,98.11,30,0,33.74,268,88,1.8,867,112,1.96,425,232,1.3,377,708,0.5,857,909,0.92,685,934,0.91,298,226,0.81,194,309,0.76,K07D4.3,WBGene00004467,Sequence name for WBGene00004467(rpn-11). History: N.A.
K07G5.1,crml-1,,Predicted myosin-I-binding protein ,sRNA_inconsistent_AND_mRNA_inconsistent,Mountain 5,37,0,8.46,32,14,0.84,54,6,4.96,141,6,6.82,241,12,23.12,54,10,5.44,31,46,0.41,258,53,1.22,214,101,1.5,436,317,1.29,521,541,0.94,445,587,0.94,202,171,0.73,129,190,0.82,K07G5.1,WBGene00010641,Sequence name for WBGene00010641(crml-1). History: N.A.
K07H8.10,K07H8.10,,,sRNA_DOWN in ego-1_AND_mRNA_inconsistent,Mountain 20,27,0,6.23,29,2,3.8,81,4,10.35,76,5,4.32,109,5,22.77,73,1,40.27,8518,3457,1.47,5998,1287,1.19,3726,1690,1.57,4550,8365,0.51,9680,2656,3.57,8753,3083,3.51,3539,1767,1.24,1271,1868,0.82,K07H8.10,WBGene00019510,Sequence name for WBGene00019510(nucl-1). History: N.A.
K08B12.5,tag-59,"mrck-1 encodes a serine/threonine-protein kinase that is orthologous to human MRCK (myotonic dystrophy kinase-related Cdc42 binding kinase) and DMPK (dystrophia myotonica-protein kinase, <a href=""http://www.ncbi.nlm.nih.gov/entrez/dispomim.cgi?id=605377"">OMIM:605377</a>); during development, MRCK-1 functions together with LET-502/ROCK to effect embryonic elongation through regulation of the MLC-4/myosin regulatory light chain. ","Rho-associated, coiled-coil containing protein kinase ",sRNA_DOWN in ego-1_AND_mRNA_inconsistent,Mountain 5,29,0,6.68,35,6,1.95,64,12,3.16,76,5,4.32,150,17,10.42,36,1,20.13,351,114,1.82,743,154,1.22,281,190,1.05,562,670,0.79,1052,798,1.29,779,725,1.33,272,289,0.58,209,438,0.58,K08B12.5,WBGene00006437,Sequence name for WBGene00006437(mrck-1). History: Renamed on 2008-07-18
K08D10.3,rnp-3,"rnp-3 encodes the small nuclear ribonucleoprotein (snRNP)-associated protein RNP-3/U2B''; genetically, rnp-3 appears to function redundantly with rnp-2/U1A: loss of rnp-3 activity alone results in low levels of embryonic and total lethality, while animals doubly mutant for rnp-3 and rnp-2/U1A show much higher levels of embryonic and total lethality; in addition, animals doubly mutant for SAP-1/U2A' and RNP-3/U2B'', display a much more severe phenotype than either single mutation, indicating that in vivo, these proteins have some independent functions; immunoprecipitation experiments indicate that RNP-3 associates with U2 RNA in vivo and that this association does not require the presence of SAP-1/U2A'. ",Spliceosomal protein snRNP-U1A/U2B ,sRNA_inconsistent_AND_mRNA_inconsistent,Mountain 2,12,2,0.96,17,0,6.84,42,3,6.78,82,1,13.95,76,2,31.88,23,0,26.12,6,0,4.17,20,18,0.28,8,20,0.31,60,33,1.69,29,73,0.4,19,76,0.32,14,17,0.52,18,14,1.53,K08D10.3,WBGene00004386,Sequence name for WBGene00004386(rnp-3). History: N.A.
K08E3.4,K08E3.4,,Drebrins and related actin binding proteins ,sRNA_DOWN in ego-1_AND_mRNA_inconsistent,,20,3,1.17,16,1,3.23,33,3,5.36,102,0,34.63,44,0,55.89,15,0,17.41,215,145,0.88,472,58,2.04,199,135,1.05,370,426,0.82,775,386,1.97,643,436,1.82,224,175,0.79,161,215,0.9,K08E3.4,WBGene00010664,Sequence name for WBGene00010664(dbn-1). History: N.A.
K08E3.6,cyk-4,"cyk-4 encodes a Rho GAP (Rho guanosine triphosphatase (GTPase) activating protein); during development, cyk-4 is required for two different processes: 1) paternally provided CYK-4 regulates anterior-posterior polarity in the one-cell embryo by controlling the actomyosin cytoskeletal network, and 2) together with ZEN-4, CYK-4 is sufficient to promote formation of the large bundles of microtubules that form the central spindle during anaphase and polarize the foregut epithelium; in addition, CYK-4 is required for fertility and coordinated locomotion postembryonically; CYK-4 is enriched in sperm and also localizes to the central spindle during anaphase interdependently with ZEN-4; CYK-4 interacts with ZEN-4 in vitro and in vivo. ",GTPase-activating protein ,sRNA_DOWN in ego-1_AND_mRNA_inconsistent,Mountain 11,44,3,2.5,44,6,2.44,105,2,22.3,117,7,4.96,179,2,74.52,81,0,89.25,23,5,2.38,126,30,1.04,123,58,1.5,228,255,0.84,757,988,0.75,637,941,0.84,246,294,0.52,180,404,0.54,K08E3.6,WBGene00000875,Sequence name for WBGene00000875(cyk-4). History: N.A.
K08E4.1,spt-5,,RNA polymerase II transcription elongation factor DSIF/SUPT5H/SPT5 ,sRNA_DOWN in ego-1_AND_mRNA_DOWN in ego-1,Mountain 5,39,0,8.9,46,4,3.57,77,5,8.2,126,6,6.1,213,10,24.16,66,0,72.92,449,86,3.08,875,218,1.02,416,251,1.18,924,832,1.05,1069,627,1.67,950,632,1.86,310,145,1.32,192,233,1.0,K08E4.1,WBGene00005015,Sequence name for WBGene00005015(spt-5). History: N.A.
K08E7.2,hsb-1,,Heat shock factor binding protein ,sRNA_DOWN in ego-1_AND_mRNA_inconsistent,Mountain 2,24,3,1.39,17,1,3.42,31,3,5.05,147,3,12.44,77,1,48.44,42,0,46.8,3,0,2.38,30,14,0.53,3,13,0.2,56,26,1.99,26,102,0.26,18,94,0.25,15,20,0.47,10,10,1.21,K08E7.2,WBGene00002002,Sequence name for WBGene00002002(hsb-1). History: N.A.
K08F4.1,K08F4.1,,DNA replication checkpoint protein CHL12/CTF18 ,sRNA_DOWN in ego-1_AND_mRNA_inconsistent,Mountain 0,35,7,1.0,42,4,3.27,98,12,4.81,181,10,5.56,211,10,23.94,38,6,6.06,40,0,24.41,207,53,0.98,122,74,1.17,356,267,1.25,408,342,1.17,397,373,1.32,188,59,1.95,107,103,1.25,K08F4.1,WBGene00010676,Sequence name for WBGene00010676(ctf-18). History: N.A.
K08F4.2,K08F4.2,,"RasGAP SH3 binding protein rasputin, contains NTF2 and RRM domains ",sRNA_DOWN in ego-1_AND_mRNA_inconsistent,Mountain 2,44,5,1.67,43,6,2.39,87,7,6.94,180,4,12.17,96,6,17.21,43,0,47.89,193,218,0.53,529,221,0.61,313,248,0.9,710,581,1.15,614,604,1.0,532,665,0.99,239,95,1.55,152,205,0.9,K08F4.2,WBGene00010677,Sequence name for WBGene00010677(gtbp-1). History: N.A.
K08F9.4,K08F9.4,,,sRNA_inconsistent_AND_mRNA_inconsistent,Mountain 11,20,3,1.17,15,10,0.55,28,3,4.58,57,4,3.9,80,2,33.53,15,0,17.41,15,0,9.53,59,14,1.02,44,22,1.4,132,63,1.96,152,172,0.87,118,168,0.87,65,21,1.86,60,35,2.04,K08F9.4,WBGene00010687,Public name for WBGene00010687. History: N.A.
K08H10.1,lea-1,"The lea-1 gene encodes a protein that is predicted to be hydrophilic and heat-resistant, and that might participate in anhydrobiosis. ",Uncharacterized conserved protein ,sRNA_inconsistent_AND_mRNA_inconsistent,Mountain 7,3,8,0.1,16,3,1.61,83,2,17.67,151,5,8.52,215,1,134.13,46,0,51.15,197,121,0.97,386,161,0.61,798,647,0.88,1186,1341,0.83,3599,4135,0.85,3046,4610,0.82,1051,883,0.74,780,921,1.02,K08H10.1,WBGene00002263,Sequence name for WBGene00002263(lea-1). History: N.A.
K09B11.9b,K09B11.9,uso-1 encodes the C. elegans ortholog of the Uso1/p115 vesicle tethering protein that in yeast has been shown to function in endoplasmic reticulum-to-Golgi transport; RNAi screens indicate that uso-1 activity is required for normal fat content and distal tip cell migration. ,,sRNA_inconsistent_AND_mRNA_inconsistent,Mountain 5,27,9,0.62,20,3,1.99,44,7,3.55,65,4,4.44,86,3,27.01,30,0,33.74,26,41,0.38,201,50,1.01,61,82,0.53,267,173,1.45,100,183,0.54,75,182,0.51,36,24,0.92,27,56,0.59,K09B11.9b,WBGene00010713,Molecule name for WBGene00010713(uso-1). History: N.A.
K09E3.6,K09E3.6,,Uncharacterized protein ,sRNA_DOWN in ego-1_AND_mRNA_inconsistent,Mountain 13,11,0,2.67,48,1,9.3,42,2,9.05,42,0,14.46,385,9,47.94,25,0,28.3,2,0,1.79,0,1,0.13,6,1,2.5,5,1,2.82,9,3,2.45,2,2,1.24,6,3,1.08,2,2,1.21,K09E3.6,WBGene00019577,Sequence name for WBGene00019577(lido-6). History: N.A.
K09H11.3,rga-3,"rga-3 encodes a GTPase-activating protein (GAP); RNAi experiments predicted to target rga-3 and the related rga-4 gene result in early embryonic defects, specifically defects in cortical contractility, non-muscle myosin NMY-2 distribution, and the relative size of PAR protein domains; in vitro, RGA-3 positively regulates RHO-1 GTPase activity, consistent with genetic studies showing that the rga-3/4(RNAi) phenotype requires RHO-1 activity; in early embryos, a YFP-RGA-3 fusion protein localizes to the cellular cortex and to centrosomes, with cortical localization segregating to the anterior during polarization. ",Chimaerin and related Rho GTPase activating proteins ,sRNA_DOWN in ego-1_AND_mRNA_inconsistent,Mountain 11,244,25,2.1,179,27,2.44,471,46,6.34,865,41,6.93,985,86,14.08,255,8,30.96,9,0,5.95,15,14,0.27,51,64,0.57,110,261,0.4,583,1267,0.45,474,1324,0.44,164,252,0.4,108,365,0.36,K09H11.3,WBGene00019600,Sequence name for WBGene00019600(rga-3). History: N.A.
K10B2.1,lin-23,"lin-23 encodes an F-box- and WD-repeat-containing protein orthologous to Saccharomyces cerevisiae MET30 and human beta TRCP (<a href=""http://www.ncbi.nlm.nih.gov/entrez/dispomim.cgi?id=603482"">OMIM:603482</a>), both components of the SCF (Skp1, Cullin, F-box) ubiquitin-ligase complex that regulates ubiquitin-mediated protein degradation; LIN-23 negatively regulates postembryonic cell divsions in all tissue types, and specifically, has been shown to function cell autonomously in the vulva to negatively regulate cell cycle progression and allow for cell cycle exit; LIN-23 also functions cell autonomously in some neurons to regulate neurite outgrowth; LIN-23 expression is first detected broadly during gastrulation, with expression continuing postembryonically in body wall and enteric muscle, hypodermal cells, and many but not all neurons; LIN-23 localizes to the cytoplasm. ",Beta-TrCP (transducin repeats containing)/Slimb proteins ,sRNA_inconsistent_AND_mRNA_inconsistent,Mountain 5,20,5,0.78,24,8,1.05,37,3,6.0,95,0,32.28,82,3,25.77,42,2,15.6,65,12,3.02,242,47,1.29,107,59,1.28,262,290,0.85,335,372,0.88,271,413,0.81,128,90,0.88,86,145,0.72,K10B2.1,WBGene00003009,Sequence name for WBGene00003009(lin-23). History: N.A.
K10B2.5,ani-2,"ani-2 encodes one of three C. elegans anillins; ANI-2 activity is required in the syncytial gonad for proper gonad structure and oocyte formation; specifically, ANI-2 appears to be required for maintaining the structure of the rachis, the syncytial compartment of germline cytoplasm that connects developing ooctyes; in the adult gonad, ANI-2 localizes to the surface of the rachis. ",Actin binding protein Anillin ,sRNA_DOWN in ego-1_AND_mRNA_inconsistent,Mountain 7,50,1,5.68,61,9,2.35,110,10,6.37,206,8,7.73,296,6,52.69,125,7,17.14,3,24,0.1,27,16,0.42,62,38,1.15,206,212,0.91,339,671,0.5,315,777,0.5,134,128,0.65,101,204,0.6,K10B2.5,WBGene00019608,Sequence name for WBGene00019608(ani-2). History: N.A.
K10B3.5,K10B3.5,,Unnamed protein ,sRNA_DOWN in ego-1_AND_mRNA_inconsistent,Mountain 1,463,14,6.89,334,20,6.06,295,31,5.84,314,17,5.88,2400,71,41.42,530,38,14.82,2,0,1.79,19,12,0.39,18,13,0.97,41,9,3.95,20,5,3.43,12,13,1.15,2,4,0.37,3,1,2.41,K10B3.5,WBGene00019611,Public name for WBGene00019611. History: N.A.
