target_name,gene,description,KOG,remarks,Mountain,fL3s446,eL3s82,FC,fL3s364,eL3s125,FC.1,fL4s660,eL4s408,FC.2,fL4s1165,eL4s377,FC.3,fADs1711,eADs213,FC.4,fADs547,eADs598,FC.5,fL3m1612,eL3m951,FC.6,fL3m4134,eL3m1037,FC.7,fL4m1857,eL4m1318,FC.8,fL4m3713,eL4m3494,FC.9,fADm2498,eADm2449,FC.10,fADm2040,eADm2527,FC.11,fADm981,eADm599,FC.12,fADm631,eADm765,FC.13,Input,Suggested Match,History
F15E6.1,set-9,"set-9 encodes a large (1,655-residue) protein with a low-complexity N-terminal region, followed by a PHD-zinc finger and a SET domain; SET-9 has no non-nematode orthologs, but has 96% identity (1616/1679 residues) to its paralog SET-26; SET-9 is required for a normally short lifespan and low spontaneous mutation rate; life extension by set-9(RNAi) requires DAF-16, indicating that SET-9 limits normal lifespan by negatively regulating DAF-16 (either directly or indirectly); otherwise, neither set-9(n4949) nor set-9(RNAi) have any obvious phenotypes. ",PHD Zn-finger proteins ,sRNA_DOWN in ego-1_AND_mRNA_UP in ego-1,Mountain 5,90,5,3.38,77,3,7.41,190,8,13.39,364,2,40.91,183,0,228.52,55,0,60.95,38,133,0.17,47,27,0.44,69,97,0.51,57,597,0.09,406,806,0.49,300,753,0.49,87,379,0.14,68,337,0.25,F15E6.1,WBGene00017482,Sequence name for WBGene00017482(set-9). History: N.A.
F16B12.6,F16B12.6,,Unnamed protein ,sRNA_inconsistent_AND_mRNA_inconsistent,Mountain 5,39,18,0.47,59,14,1.52,144,18,4.82,239,24,3.23,368,20,21.82,49,9,5.44,113,109,0.62,220,50,1.1,125,60,1.47,158,174,0.86,216,97,2.17,195,122,1.97,83,25,2.0,50,33,1.81,F16B12.6,WBGene00008882,Public name for WBGene00008882. History: N.A.
F16D3.4,F16D3.4,"F16D3.4 encodes a putative beta-tubulin folding cofactor D, orthologous to human TBCD (<a href=""http://www.ncbi.nlm.nih.gov/entrez/dispomim.cgi?id=604649"">OMIM:604649</a>); in early embryos, F16D3.4 is required for normally rapid microtubule elongation; F16D3.4 may be a ligand and effector of the ARL2 ortholog EVL-20; F16D3.4 is expressed in larval and adult pharynx, intestine, and neurons; in mass RNAi assays, F16D3.4 is required for normal mitotic spindle elongation, embryonic and larval viability, fertility, locomotion, body shape, vulval development, and cuticular integrity. ",Beta-tubulin folding cofactor D ,sRNA_DOWN in ego-1_AND_mRNA_inconsistent,Mountain 11,25,3,1.45,33,4,2.58,49,5,5.26,63,0,21.52,151,6,26.97,34,0,38.09,24,39,0.37,119,30,0.99,42,39,0.77,190,141,1.27,214,317,0.66,172,353,0.6,111,73,0.94,65,104,0.76,F16D3.4,WBGene00008887,Sequence name for WBGene00008887(tbcd-1). History: N.A.
F17C11.10,F17C11.10,,WD40 repeat protein ,sRNA_DOWN in ego-1_AND_mRNA_UP in ego-1,Mountain 11,54,0,12.24,53,7,2.56,157,14,6.65,199,5,11.21,184,5,38.29,32,0,35.92,46,60,0.46,119,39,0.76,147,118,0.89,365,491,0.7,716,830,0.85,606,915,0.82,228,187,0.75,165,249,0.8,F17C11.10,WBGene00008921,Sequence name for WBGene00008921(ctf-4). History: N.A.
F17C11.9b,F17C11.9,,Glutathione S-transferase ,sRNA_DOWN in ego-1_AND_mRNA_inconsistent,Mountain 23,30,0,6.9,28,5,1.84,88,2,18.72,197,0,66.58,47,1,29.81,38,10,3.86,2060,1309,0.94,5006,1701,0.75,1579,1662,0.68,4902,3861,1.2,3269,2653,1.21,2843,2792,1.26,1691,587,1.78,1040,762,1.65,F17C11.9b,WBGene00008920,Molecule name for WBGene00008920(eef-1G). History: N.A.
F17C8.1,acy-1,"acy-1 encodes a protein with 40% identity to mammalian adenylyl cyclases and is most closely related to the divergent mouse isoform type IX; acy-1 is required for viability, muscle contraction, locomotion, molting, and regulation of sleep-like behavior (lethargus) during larval development; acy-1 acts genetically downstream of gsa-1 and is expressed in excitable cells. ",Adenylyl cyclase ,sRNA_UP in ego-1_AND_mRNA_inconsistent,Mountain 1,20,5,0.78,16,9,0.65,34,82,0.27,61,134,0.15,250,2305,0.14,123,568,0.24,54,48,0.67,116,29,0.99,20,29,0.5,117,52,2.1,15,18,0.83,9,22,0.54,2,2,0.62,3,6,0.69,F17C8.1,WBGene00000068,Sequence name for WBGene00000068(acy-1). History: N.A.
F18C12.2a,rme-8,"The rme-8 gene encodes a J-domain protein that is required for both receptor-mediated and fluid-phase endocytosis in coelomocytes and other cell types, and that is also required for development and viability. ","Endocytosis protein RME-8, contains DnaJ domain ",sRNA_DOWN in ego-1_AND_mRNA_inconsistent,Mountain 5,52,6,1.69,57,14,1.47,115,18,3.85,121,9,4.1,233,9,29.06,44,0,48.98,61,68,0.54,389,125,0.79,198,166,0.85,575,360,1.5,301,502,0.59,239,531,0.56,76,102,0.46,66,94,0.85,F18C12.2a,WBGene00004378,Molecule name for WBGene00004378(rme-8). History: N.A.
F18C5.2,wrn-1,"wrn-1 encodes an ortholog of human WRN, which when mutated leads to Werner syndrome (<a href=""http://www.ncbi.nlm.nih.gov/entrez/dispomim.cgi?id=277700"">OMIM:277700</a>), and one of four C. elegans homologs of the RecQ DNA helicase family that includes E. coli RecQ; by homology, WRN-1 is predicted to function as a helicase, DNA-dependent ATPase, and exonuclease that plays a key role in DNA replication, recombination, and repair; RNA interference studies in C. elegans and the enhancement of many of the resulting phenotypes by ionizing radiation indicate that wrn-1 affects life span and aging and acts at a DNA damage checkpoint; the wrn-1 phenotypes such as premature aging are similar to those of Werner syndrome; immunolocalization studies indicate that WRN-1 expression is nuclear in cells at the embryonic, larval and adult stages. ",ATP-dependent DNA helicase ,sRNA_DOWN in ego-1_AND_mRNA_inconsistent,Mountain 2,30,0,6.9,34,8,1.48,52,4,6.69,60,3,5.13,135,18,8.89,42,1,23.4,13,35,0.23,53,15,0.86,36,23,1.1,122,69,1.65,129,152,0.83,88,199,0.55,90,41,1.34,52,69,0.91,F18C5.2,WBGene00006944,Sequence name for WBGene00006944(wrn-1). History: N.A.
F18E2.2,abcf-1,,eIF2-interacting protein ABC50 (ABC superfamily) ,sRNA_DOWN in ego-1_AND_mRNA_inconsistent,Mountain 20,20,0,4.67,35,3,3.42,43,1,13.88,29,0,10.09,68,0,85.69,13,0,15.24,227,163,0.83,481,148,0.82,253,195,0.92,836,790,1.0,486,485,0.98,462,563,1.01,373,101,2.27,144,163,1.07,F18E2.2,WBGene00006512,Sequence name for WBGene00006512(abcf-1). History: N.A.
F18E2.3,scc-3,"scc-3 encodes a cohesin complex subunit homologous to Saccharomyces cerevisiae Irr1p/Scc3p; SCC-3 is required during meiosis for synaptonemal complex formation and sister chromatid cohesion, proper localization of REC-8 to chromosomes, mitotic chromosome segregation, embryonic development, and vulval morphogenesis; in embryos, SCC-3 forms a cohesin complex with SCC-1, SMC-1, SMC-3, and TIM-1, a HEAT/Armadillo repeat-containing protein related to Drosophila TIMELESS; in the germline, SCC-3 associates with chromatin of transistion zone nuclei, assembles along the longitudinal axes of synapsed chromosomes at pachytene, and unlike other cohesins, localizes throughout chromatin at diakinesis; SCC-3 localization requires TIM-1, and SCC-3 and REC-8 are mutually required for chromatin localization. ","Sister chromatid cohesion complex Cohesin, subunit STAG/IRR1/SCC3 ",sRNA_DOWN in ego-1_AND_mRNA_inconsistent,Mountain 5,34,0,7.79,42,4,3.27,89,5,9.47,150,10,4.62,198,11,20.6,39,4,8.71,86,77,0.66,303,64,1.19,184,102,1.28,540,212,2.39,357,470,0.75,311,545,0.71,200,85,1.45,160,126,1.53,F18E2.3,WBGene00004738,Sequence name for WBGene00004738(scc-3). History: N.A.
F19B6.1b,F19B6.1,,,sRNA_DOWN in ego-1_AND_mRNA_inconsistent,Mountain ,16,0,3.78,16,2,2.15,40,4,5.17,48,3,4.12,35,1,22.36,37,2,13.79,84,38,1.3,263,120,0.56,175,151,0.83,361,599,0.57,422,559,0.74,340,524,0.8,96,89,0.67,97,141,0.83,F19B6.1b,WBGene00008948,Molecule name for WBGene00008948(F19B6.1). History: N.A.
F19B6.2b,ufd-1,,Ubiquitin fusion-degradation protein ,sRNA_DOWN in ego-1_AND_mRNA_inconsistent,Mountain 2,15,0,3.56,9,0,3.8,34,1,11.04,50,1,8.57,61,2,25.67,30,4,6.75,45,0,27.39,204,32,1.58,90,49,1.3,142,196,0.68,228,251,0.89,159,262,0.75,69,45,0.94,42,86,0.6,F19B6.2b,WBGene00006733,Molecule name for WBGene00006733(ufd-1). History: N.A.
F19F10.11a,F19F10.11,"F19F10.11 encodes a protein with a THAP or THAP-like domain; other proteins with such domains include LIN-15A, LIN-15B, LIN-36, and HIM-17 (which all interact with LIN-35/Rb), as well as CDC-14B, CTB-1, GON-14, and ~100 other proteins such as Drosophila P element transposase and human nuclear proapoptotic factor THAP1. ",Tam3-transposase (Ac family) ,sRNA_DOWN in ego-1_AND_mRNA_inconsistent,,42,4,1.91,37,6,2.06,45,6,4.15,68,3,5.8,129,22,7.02,51,4,11.32,6,0,4.17,106,31,0.85,105,63,1.18,189,141,1.26,253,384,0.65,186,364,0.63,93,74,0.78,86,134,0.78,F19F10.11a,WBGene00017607,Molecule name for WBGene00017607(F19F10.11). History: N.A.
F20C5.1a,pme-3,"pme-3 encodes a poly(ADP-ribose) glycohydrolase (PARG) orthologous to human PARG (<a href=""http://www.ncbi.nlm.nih.gov/entrez/dispomim.cgi?id=603501"">OMIM:603501</a>) and paralogous to PME-4; PME-3 has PARG activity in vitro, and is required in vivo for normal resistance to ionizing radiation; PME-3 is primarily expressed in the nuclei of nerve cells, and in embryos; neuronal expression of PME-3 may reflect a requirement for PARG in preventing neurodegeneration like that seen in Drosophila. ",,sRNA_DOWN in ego-1_AND_mRNA_inconsistent,Mountain 11,42,0,9.57,40,3,3.89,80,7,6.39,121,7,5.13,131,24,6.56,49,9,5.44,26,42,0.37,162,36,1.12,116,57,1.44,293,245,1.13,271,405,0.66,237,438,0.67,114,60,1.17,46,115,0.49,F20C5.1a,WBGene00004051,Molecule name for WBGene00004051(parg-1). History: Renamed on 2014-11-18
F20D12.1b,csr-1,"csr-1 encodes, by alternative splicing, two isoforms of an Argonaute protein required for chromosome segregation, embryonic viability, Slicer activity induced by secondary siRNAs, and (partially) for germline RNAi; csr-1(RNAi) embryos are generally inviable, with disordered metaphase chromosomes and anaphase DNA bridges; CSR-1 is found in secondary-type siRNA/Slicer complexes, and isolated recombinant CSR-1 itself shows Slicer activity with secondary-type siRNAs; csr-1(fj54) mutant cell-free extracts have only 10% the normal level of secondary siRNA-induced Slicer activity; csr-1 mutants are partially defective in germline RNAi; CSR-1 belongs to a nematode-specific group of Argonaute homologs, and is most closely related to C04F12.1; like ALG-1/2 and RDE-1, but unlike some other Argonaute homologs, CSR-1 retains key catalytic residues in an RNAse H domain. ",Translation initiation factor 2C (eIF-2C) and related proteins ,sRNA_DOWN in ego-1_AND_mRNA_UP in ego-1,Mountain 7,346,24,3.09,272,61,1.67,726,18,24.15,1721,8,64.33,805,1,500.51,279,3,76.19,9,47,0.12,84,128,0.17,173,338,0.37,462,913,0.48,367,2022,0.18,336,2109,0.2,86,271,0.2,88,274,0.39,F20D12.1b,WBGene00017641,Molecule name for WBGene00017641(csr-1). History: N.A.
F20D12.2,F20D12.2,,Nuclear protein export factor ,sRNA_inconsistent_AND_mRNA_inconsistent,Mountain 11,42,14,0.64,35,10,1.24,98,12,4.81,230,6,11.1,192,6,34.24,85,2,31.2,223,95,1.39,548,105,1.32,289,175,1.18,610,544,1.06,760,650,1.15,589,741,0.98,263,203,0.8,172,248,0.84,F20D12.2,WBGene00017642,Public name for WBGene00017642. History: N.A.
F20D12.4,czw-1,,Centromere/kinetochore protein zw10 involved in mitotic chromosome segregation ,sRNA_DOWN in ego-1_AND_mRNA_inconsistent,Mountain 7,33,4,1.51,33,6,1.84,76,1,24.3,174,1,29.42,99,1,62.1,24,0,27.21,5,34,0.1,186,55,0.85,38,67,0.41,287,233,1.16,486,748,0.64,406,768,0.65,180,115,0.97,148,123,1.45,F20D12.4,WBGene00017643,Sequence name for WBGene00017643(czw-1). History: N.A.
F20G4.3,nmy-2,"nmy-2 encodes a maternally expressed nonmuscle myosin II required for polarized cytoplasmic flow, polarized distribution of the PAR proteins, cytokinesis, and for proper anterior-posterior polarity in early embryos; NMY-2 functions with PAR-5 in the onset of the establishment phase of polarization in the C. elegans zygote along the anterior-posterior axis, and nmy-2 is partially redundant with nmy-1 with respect to embryonic elongation; localization of NMY-2 is dynamic in oocytes and embryos. ",Myosin class II heavy chain ,sRNA_inconsistent_AND_mRNA_inconsistent,,54,21,0.56,32,4,2.51,68,8,4.84,119,6,5.76,133,5,27.74,47,0,52.24,710,608,0.7,1437,319,1.15,1544,576,1.91,1886,2039,0.87,5586,2715,2.02,4767,2864,2.06,1668,1054,0.98,845,1094,0.93,F20G4.3,WBGene00003777,Sequence name for WBGene00003777(nmy-2). History: N.A.
F20H11.3,mdh-1,mdh-1 encodes a homolog of malate dehydrogenase that is predicted to be mitochondrial. ,NAD-dependent malate dehydrogenase ,sRNA_DOWN in ego-1_AND_mRNA_inconsistent,Mountain 20,22,0,5.12,26,4,2.05,61,5,6.52,153,6,7.4,60,12,5.83,22,4,5.01,310,189,0.97,1043,502,0.53,269,299,0.64,786,514,1.44,359,445,0.79,260,433,0.74,75,96,0.48,110,105,1.26,F20H11.3,WBGene00003162,Sequence name for WBGene00003162(mdh-2). History: Renamed on 2010-08-18
F21C3.4b,rde-2,"rde-2 encodes a novel protein that is conserved in at least two other Caenorhabditis species; rde-2 is required for the functional silencing of chromosomal loci by transgenes (cosuppression) and promotes the effects of RNAi in a step after the formation of a heritable interfering agent, also affects X-chromosome nondisjunction and transposon activation; functions downstream of rde-1 in the RNAi pathway most effective against germline, but not somatically expressed, genes; RDE-2 is present predominantly in the cytosol, in complexes with MUT-7, a predicted exoribonuclease also required for RNA interference. ",,sRNA_DOWN in ego-1_AND_mRNA_inconsistent,Mountain 2,23,0,5.34,24,1,4.75,42,1,13.57,69,0,23.54,87,1,54.65,35,0,39.18,3,0,2.38,29,11,0.64,4,14,0.24,70,42,1.55,82,161,0.5,61,179,0.43,77,19,2.41,28,24,1.4,F21C3.4b,WBGene00004324,Molecule name for WBGene00004324(rde-2). History: N.A.
F21G4.2,mrp-4,"mrp-4 encodes a putative member of subfamily C of the ATP-binding cassette transporters; MRP-4 is required, redundantly with its paralog WHT-2, for sperm to normally migrate towards a PUFA-based signal exuded by oocytes; hermaphrodites subjected to double wht-2(RNAi) mrp-4(RNAi) are infertile, both through aberrant loss of their own sperm and through failure of males to effectively inseminate them; in mammalian eicosanoid signalling, subfamily C ABC transporters are required for PUFA and eicosanoid transport. ","Multidrug resistance-associated protein/mitoxantrone resistance protein, ABC superfamily ",sRNA_inconsistent_AND_mRNA_inconsistent,Mountain 11,47,0,10.68,38,14,0.99,79,15,3.16,135,10,4.16,133,3,41.61,93,4,20.46,119,75,0.94,244,58,1.06,86,68,0.9,161,480,0.32,972,2800,0.34,828,2877,0.36,297,933,0.2,226,958,0.29,F21G4.2,WBGene00003410,Sequence name for WBGene00003410(mrp-4). History: N.A.
F21H12.5,fbf-2,"fbf-2 encodes an RNA-binding protein that is one of 11 C. elegans members of the PUF family (Pumilio and FBF) of translational regulators; FBF-2 is nearly identical to FBF-1 with which it is largely redundant in regulating two aspects of germline development: 1)maintenance of stem cell proliferation, and 2)the hermaphroditic switch between spermatogenesis and oogenesis; in maintaining germline stem cells, the FBF proteins, acting through NOS-3, negatively regulate the activity of gld-1 mRNA, which encodes a translational repressor required for meiotic entry; in regulating the sperm-to-oocyte switch, the FBFs act downstream of GLD-3 to negatively regulate the activity of fem-3 mRNA, which encodes a novel protein required for germline sex determination; consistent with their role in germline development, FBF-1 and FBF-2 are expressed in the germline cytoplasm, becoming enriched in the mitotic region during the L4 larval and adult stages. ",Translational repressor Pumilio/PUF3 and related RNA-binding proteins (Puf superfamily) ,sRNA_DOWN in ego-1_AND_mRNA_inconsistent,Mountain 7,91,0,20.48,102,8,4.35,164,6,14.88,479,8,17.93,375,8,51.89,121,0,132.78,30,17,1.03,26,22,0.3,94,75,0.89,203,167,1.14,106,146,0.71,91,193,0.59,59,22,1.61,41,44,1.13,F21H12.5,WBGene00001402,Sequence name for WBGene00001402(fbf-2). History: N.A.
F22B3.4,F22B3.4,"F22B3.4 encodes a putative glucosamine-fructose 6-phosphate aminotransferase, paralogous to F07A11.2, thought to catalyse the first step of the hexosamine pathway to UDP-N-acetylglucosamine or UDP-N-acetylgalactosamine; F22B3.4 transcripts are enriched during oogenesis; F22B3.4(RNAi) animals have an osmotically-sensitive embryonic lethal phenotype, presumably because of defects in chitin and eggshell synthesis. ","Glucosamine 6-phosphate synthetases, contain amidotransferase and phosphosugar isomerase domains ",sRNA_inconsistent_AND_mRNA_inconsistent,Mountain 7,53,0,12.02,30,19,0.59,81,11,4.31,168,9,5.68,130,37,4.28,58,16,3.78,12,0,7.74,7,3,0.51,34,15,1.56,171,98,1.64,1328,1289,1.01,1030,1268,1.0,458,179,1.58,396,208,2.29,F22B3.4,WBGene00009035,Sequence name for WBGene00009035(gfat-2). History: N.A.
F22B5.2,eif-3.G,"eif-3.G encodes a homolog of eukaryotic translation initiation factor 3, subunit 4 that affects embryonic viability, fertility, and growth. ","Translation initiation factor 3, subunit g (eIF-3g) ",sRNA_inconsistent_AND_mRNA_inconsistent,Mountain 1,18,4,0.85,15,2,2.03,66,6,6.04,101,1,17.15,137,5,28.56,29,2,10.88,281,258,0.65,982,177,1.41,382,213,1.28,648,838,0.73,648,448,1.42,537,476,1.39,255,73,2.14,146,220,0.8,F22B5.2,WBGene00001230,Sequence name for WBGene00001230(eif-3.G). History: N.A.
F22B5.7,zyg-9,"zyg-9 encodes a predicted microtubule-association protein (MAP) of the XMAP215 family; during early embryonic development, maternal zyg-9 activity is required for microtubule-dependent processes such as meiotic and mitotic spindle organization and pronuclear migration; further, zyg-9 is essential for formation of long astral microtubules; ZYG-9 is required for centrosomal localization of TAC-1, the sole C. elegans TACC family member, with which it interacts, and mutually stabilizes, in vivo; in early embryos, ZYG-9 localizes to the meiotic spindle and spindle poles, as well as to mitotic centrosomes; during metaphase and anaphase ZYG-9 localizes to the central spindle region, and during interphase ZYG-9 is cytoplasmic; proper localization of ZYG-9 to the meiotic spindle is dependent upon wild-type activity of MEI-1, an ATPase essential for meiotic spindle formation, while proper localization of ZYG-9 to centrosomes is dependent, at least in part, upon TAC-1. ",Microtubule-associated protein ,sRNA_DOWN in ego-1_AND_mRNA_inconsistent,Mountain 5,114,5,4.27,104,13,2.85,195,12,9.51,364,12,9.44,290,19,18.07,125,1,68.57,197,91,1.28,432,125,0.88,211,185,0.81,616,651,0.89,1061,1869,0.56,874,1871,0.58,240,388,0.38,210,407,0.62,F22B5.7,WBGene00006994,Sequence name for WBGene00006994(zyg-9). History: N.A.
F22B5.9,frs-2,,Phenylalanyl-tRNA synthetase beta subunit ,sRNA_inconsistent_AND_mRNA_inconsistent,Mountain 2,31,0,7.12,25,14,0.66,52,6,4.78,109,2,12.33,97,3,30.43,56,0,62.04,45,120,0.23,227,132,0.44,85,106,0.57,441,271,1.53,153,370,0.41,134,412,0.4,70,47,0.91,70,43,1.95,F22B5.9,WBGene00001498,Sequence name for WBGene00001498(fars-3). History: Renamed on 2010-01-29
F22B7.13,gpr-1,"gpr-1 encodes an extremely similar (97% identity) paralog of GPR-2; GPR-1 (and GPR-2) proteins have two N-terminal tetratricopeptide-like motifs and a C-terminal GoLoco/GPR (G protein regulatory) motif, the latter of which has also been found in mammalian AGS3 and Drosophila Pins; GPR-1 is required for normally asymmetrical cleavage of one-cell embryos; GPR-1 and GPR-2 form a high molecular weight (~700 kDa) complex that includes LIN-5; GPR-1 binds GDP-bound GOA-1 via a GoLoco/GPR motif, and depends on RIC-8 for this binding; GPR-1/2, GOA-1, and LIN-5 colocalize at the cortex of early embryos; cortical enrichment of GPR-1 requires LIN-5, PAR-2, PAR-3, and LET-99; the asymmetric distribution of GPR-1/2 and LET-99 in EMS cells is dependent on MES-1/SRC-1 signaling; GPR-1/2 is co-immunoprecipitated with RIC-8 and GPA-16. ",Unnamed protein ,sRNA_DOWN in ego-1_AND_mRNA_inconsistent,,11,0,2.67,18,4,1.44,57,0,36.6,50,0,17.15,78,0,98.11,17,0,19.59,1,0,1.19,20,3,1.34,12,12,0.71,37,78,0.45,39,237,0.16,20,188,0.14,16,56,0.18,9,101,0.12,F22B7.13,WBGene00001688,Sequence name for WBGene00001688(gpr-1). History: N.A.
F22B7.5b,dnj-10,This gene encodes a protein containing a DnaJ ('J') domain that is predicted to be mitochondrial. ,Molecular chaperone (DnaJ superfamily) ,sRNA_inconsistent_AND_mRNA_inconsistent,,32,0,7.35,37,5,2.41,57,2,12.2,96,1,16.31,155,6,27.68,15,0,17.41,155,58,1.57,434,78,1.4,134,66,1.44,336,372,0.85,276,420,0.65,203,473,0.53,139,216,0.4,63,168,0.46,F22B7.5b,WBGene00001028,Molecule name for WBGene00001028(dnj-10). History: N.A.
F22F1.2,F22F1.2,,Casein kinase (serine/threonine/tyrosine protein kinase) ,sRNA_UP in ego-1_AND_mRNA_inconsistent,Mountain 9,1,0,0.45,2,1,0.57,0,13,0.05,5,13,0.14,6,161,0.05,2,72,0.04,0,0,0.6,3,0,1.02,1,1,0.71,0,0,0.94,0,10,0.09,0,9,0.12,1,0,1.24,0,3,0.3,F22F1.2,WBGene00017714,Public name for WBGene00017714. History: N.A.
F22F7.5,ckb-4,"ckb-4 encodes an isoform of choline kinase whose activity has been verified in vitro, and that has a strong preference for choline over ethanolamine; CKB-1 through CKB-4 comprise a related group ('B') of choline kinases. ",Choline kinase ,sRNA_DOWN in ego-1_AND_mRNA_inconsistent,Mountain 24,23,0,5.34,30,4,2.35,34,3,5.52,76,6,3.7,363,24,18.08,74,12,6.28,17,0,10.72,101,18,1.37,56,16,2.39,79,43,1.71,19,10,1.78,12,16,0.95,4,2,1.03,7,7,1.21,F22F7.5,WBGene00000514,Sequence name for WBGene00000514(ckb-4). History: N.A.
F23B12.8,bmk-1,"bmk-1 encodes the sole C. elegans BimC/kinesin-5 homolog; while BMK-1 activity is not essential for mitotic progression or development, BMK-1 does play a role in negatively regulating interpolar microtubule sliding during anaphase spindle elongation, thus serving as a brake to slow the rate of spindle-pole separation; BMK-1 localizes to mitotic and meiotic spindles and becomes concentrated at the spindle midzone during mitotic anaphase and telophase; in vivo, BMK-1 localization is dependent upon the AIR-2/Aurora B kinase with which it interacts and serves as a substrate in vitro. ",Kinesin-like protein ,sRNA_DOWN in ego-1_AND_mRNA_inconsistent,,65,5,2.45,67,4,5.16,154,18,5.15,170,14,3.83,299,12,28.66,154,0,168.7,64,32,1.17,188,40,1.17,197,100,1.4,278,335,0.78,648,850,0.75,560,878,0.79,273,303,0.56,193,369,0.63,F23B12.8,WBGene00000257,Sequence name for WBGene00000257(bmk-1). History: N.A.
F23F1.9,F23F1.9,,"CCAAT-binding factor, subunit C (HAP5) ",sRNA_DOWN in ego-1_AND_mRNA_inconsistent,Mountain 7,11,0,2.67,43,2,5.57,31,2,6.73,35,0,12.1,99,1,62.1,13,0,15.24,33,102,0.2,91,44,0.52,58,51,0.81,187,217,0.81,87,109,0.78,78,154,0.63,49,20,1.47,36,34,1.28,F23F1.9,WBGene00017749,Sequence name for WBGene00017749(rpoa-49). History: N.A.
F23F12.6,rpt-3,"rpt-3 encodes a triple A ATPase subunit of the 26S proteasome's 19S regulatory particle (RP) base subcomplex; RPT-3 is required for embryonic, larval, and germline development and by homology, is predicted to function in unfolding protein substrates and translocating them into the core proteolytic particle (CP) of the proteasome. ","26S proteasome regulatory complex, ATPase RPT3 ",sRNA_DOWN in ego-1_AND_mRNA_inconsistent,Mountain 11,11,1,1.34,10,1,2.09,31,0,20.19,46,0,15.8,54,0,68.31,51,0,56.59,54,85,0.38,373,79,1.19,95,112,0.61,434,343,1.19,397,432,0.9,346,436,0.98,138,73,1.16,117,89,1.58,F23F12.6,WBGene00004503,Sequence name for WBGene00004503(rpt-3). History: N.A.
F23H11.1,bra-2,"The bra-2 gene encodes a homolog of the human BMP receptor-associated molecule (BRAM1), paralogous to bra-1, that may act upon the SMA-6 TGF-beta signalling pathway ",PHD Zn-finger protein ,sRNA_inconsistent_AND_mRNA_inconsistent,Mountain 11,9,0,2.23,20,2,2.66,24,2,5.26,54,1,9.25,67,0,84.45,33,0,37.0,3,39,0.06,51,19,0.66,29,20,1.02,166,76,2.04,112,205,0.54,98,193,0.63,95,39,1.48,54,34,1.9,F23H11.1,WBGene00017757,Sequence name for WBGene00017757(bra-2). History: Renamed on 2005-05-06
F25B3.6,F25B3.6,,"Paf1/RNA polymerase II complex, RTF1 component (involved in regulation of TATA box-binding protein) ",sRNA_inconsistent_AND_mRNA_inconsistent,Mountain 11,36,11,0.69,20,5,1.33,27,3,4.42,63,3,5.38,121,9,15.15,50,1,27.75,63,18,2.01,346,80,1.09,122,94,0.92,418,301,1.31,1239,804,1.51,999,864,1.43,451,183,1.52,307,258,1.43,F25B3.6,WBGene00009103,Sequence name for WBGene00009103(rtfo-1). History: N.A.
F25B4.6,F25B4.6,"F25B4.6 is orthologous to the human gene 3-HYDROXY-3-METHYLGLUTARYL COA SYNTHASE (HMGCS2; <a href=""http://www.ncbi.nlm.nih.gov/entrez/dispomim.cgi?id=600234"">OMIM:600234</a>), which when mutated leads to disease. ",Hydroxymethylglutaryl-CoA synthase ,sRNA_DOWN in ego-1_AND_mRNA_inconsistent,Mountain 44,33,0,7.57,29,0,11.39,76,3,12.15,116,7,4.92,178,5,37.05,47,5,8.71,19,25,0.46,98,34,0.72,59,42,1.0,141,88,1.5,28,77,0.36,21,80,0.34,14,7,1.16,10,10,1.21,F25B4.6,WBGene00017769,Sequence name for WBGene00017769(hmgs-1). History: Renamed on 2005-03-17
F25B5.2,F25B5.2,,,sRNA_inconsistent_AND_mRNA_inconsistent,Mountain 7,72,17,0.9,55,15,1.33,114,6,10.37,228,9,7.7,307,25,14.71,100,13,7.85,29,0,17.86,33,21,0.39,56,63,0.64,145,175,0.78,352,1382,0.25,291,1386,0.26,161,320,0.31,93,305,0.37,F25B5.2,WBGene00017774,Sequence name for WBGene00017774(nop-1). History: N.A.
F25B5.4c,ubq-1,,Ubiquitin and ubiquitin-like proteins ,sRNA_inconsistent_AND_mRNA_inconsistent,Mountain 5,18,6,0.6,15,11,0.51,78,3,12.46,232,3,19.59,135,2,56.3,61,2,22.49,413,169,1.45,2960,454,1.66,929,818,0.81,2208,1718,1.21,4109,5480,0.74,3428,5301,0.8,1031,696,0.92,1155,935,1.49,,,
F25H2.11,tct-1,,Microtubule-binding protein (translationally controlled tumor protein) ,sRNA_DOWN in ego-1_AND_mRNA_inconsistent,Mountain 2,16,2,1.26,13,0,5.32,94,1,29.98,161,0,54.47,62,2,26.08,35,0,39.18,2304,1113,1.23,5709,1660,0.88,2023,2123,0.68,4151,4554,0.86,2588,2791,0.91,2254,2814,0.99,1123,1047,0.66,815,762,1.29,F25H2.11,WBGene00009122,Sequence name for WBGene00009122(tct-1). History: N.A.
