target_name,gene,description,KOG,remarks,Mountain,fL3s446,eL3s82,FC,fL3s364,eL3s125,FC.1,fL4s660,eL4s408,FC.2,fL4s1165,eL4s377,FC.3,fADs1711,eADs213,FC.4,fADs547,eADs598,FC.5,fL3m1612,eL3m951,FC.6,fL3m4134,eL3m1037,FC.7,fL4m1857,eL4m1318,FC.8,fL4m3713,eL4m3494,FC.9,fADm2498,eADm2449,FC.10,fADm2040,eADm2527,FC.11,fADm981,eADm599,FC.12,fADm631,eADm765,FC.13,Input,Suggested Match,History
T23G7.1,dpl-1,"dpl-1 encodes the C. elegans ortholog of mammalian DP, the E2F-heterodimerization partner; dpl-1 is a class B synMuv gene whose activity is required for oogenesis as well as embryonic asymmetry and vulval development; in addition, dpl-1 acts with a subset of class B synMuv genes and the MCD-1 zinc-finger protein to promote the killing process during programmed cell death; DPL-1 is a nuclear protein that is widely expressed throughout development in both somatic and germ cell lineages. ",E2F-like protein ,sRNA_DOWN in ego-1_AND_mRNA_inconsistent,Mountain 11,32,4,1.47,26,4,2.05,71,9,4.54,143,5,8.07,146,7,22.82,25,3,7.07,19,0,11.91,37,15,0.61,58,35,1.17,202,80,2.36,239,473,0.5,188,517,0.45,153,57,1.64,63,82,0.93,T23G7.1,WBGene00001061,Sequence name for WBGene00001061(dpl-1). History: N.A.
T23H2.1,npp-12,"npp-12 encodes Gp210, an evolutionarily conserved membrane protein of the nuclear pore complex (NPC); NPP-12 is required for embryonic viability and normal nuclear membrane structures. ","Nuclear pore complex, gp210 component ",sRNA_inconsistent_AND_mRNA_inconsistent,,38,10,0.79,53,6,2.93,76,9,4.86,167,9,5.65,284,10,32.18,61,7,8.43,195,95,1.22,315,138,0.58,229,194,0.84,552,423,1.23,580,732,0.78,509,811,0.78,125,113,0.68,98,120,0.99,T23H2.1,WBGene00003798,Sequence name for WBGene00003798(npp-12). History: N.A.
T23H2.3,T23H2.3,,,sRNA_inconsistent_AND_mRNA_inconsistent,Mountain 11,25,6,0.83,36,1,7.03,50,7,4.02,135,12,3.52,157,3,49.06,43,0,47.89,79,13,3.4,260,59,1.11,217,101,1.52,412,450,0.86,730,683,1.05,591,700,1.04,299,159,1.16,162,216,0.91,T23H2.3,WBGene00020742,Public name for WBGene00020742. History: N.A.
T24C4.6a,zer-1,"zer-1 encodes a protein that contains a VHL (von Hippel-Lindau)-box motif and is a member of the ZYG11 family of ubiquitin ligase substrate recognition subunits; ZER-1 interacts with the CUL-2 cullin in vivo and modestly enhances the lethality produced by a temperature-sensitive allele of zyg-11; in yeast two-hybrid assays, ZER-1 interacts with CUL-2 and additionally with SKR-1 and ELC-1. ",,sRNA_inconsistent_AND_mRNA_inconsistent,Mountain 30,34,8,0.87,35,10,1.24,47,4,6.06,109,4,7.4,102,10,11.63,52,8,6.41,137,94,0.87,733,137,1.36,293,223,0.94,647,473,1.29,390,437,0.88,335,504,0.82,260,121,1.32,176,183,1.16,T24C4.6a,WBGene00020762,Molecule name for WBGene00020762(zer-1). History: N.A.
T24F1.1,raga-1,,GTP-binding protein ,sRNA_DOWN in ego-1_AND_mRNA_inconsistent,Mountain 2,24,1,2.78,20,2,2.66,49,6,4.51,96,2,10.87,123,0,154.0,44,0,48.98,44,14,1.79,209,66,0.8,71,60,0.84,261,260,0.94,265,343,0.76,243,324,0.93,104,71,0.9,79,88,1.08,T24F1.1,WBGene00006414,Sequence name for WBGene00006414(raga-1). History: Renamed on 2007-07-20
T24H7.1,phb-2,"phb-2 encodes one of two subunits of the mitochondrial prohibitin complex; loss of phb-2 activity via RNAi indicates that phb-2 function is required for mitochondrial biogenesis and maintenance and for embryonic, germline, and somatic gonad development. ",,sRNA_DOWN in ego-1_AND_mRNA_inconsistent,Mountain 20,33,5,1.26,30,3,2.94,92,4,11.74,130,3,11.01,166,0,207.41,67,0,74.01,200,97,1.22,899,251,0.91,270,216,0.89,562,564,0.94,392,909,0.42,327,969,0.42,138,198,0.43,110,156,0.85,T24H7.1,WBGene00004015,Sequence name for WBGene00004015(phb-2). History: N.A.
T25G3.2,chs-1,"chs-1 encodes a chitin synthase, paralogous to CHS-2; chs-1 is required for embryonic chitin synthesis, eggshell synthesis and osmotic integrity, error-free chromosomal segregation during meiosis, polar body extrusion, association of the sperm pronucleus/centrosome complex (SPCC) with the early embryonic cortex, localization of PAR-2 in early embryos, posterior localization of P granules or PIE-1, and pseudocleavage; CHS-1 is also, independently of chitin synthesis, required for normal localization of MBK-2 to cortex and punctae in early embryos; CHS-1 is dispensable for synthesis of pharyngeal cuticle, since chs-1(ok1120) mutants have it normally; CHS-1 is predicted to be in the plasma membrane rather than the Golgi apparatus. ",,sRNA_DOWN in ego-1_AND_mRNA_inconsistent,Mountain 7,67,6,2.16,41,15,1.0,40,6,3.7,105,6,5.09,208,13,18.54,109,1,59.86,12,0,7.74,20,9,0.54,62,23,1.87,178,164,1.02,2137,1575,1.33,1757,1650,1.32,771,402,1.18,459,414,1.34,T25G3.2,WBGene00000496,Sequence name for WBGene00000496(chs-1). History: N.A.
T26A5.5a,T26A5.5,,"F-box protein JEMMA and related proteins with JmjC, PHD, F-box and LRR domains ",sRNA_DOWN in ego-1_AND_mRNA_inconsistent,Mountain 2,159,18,1.87,151,19,2.89,289,14,12.2,624,6,30.02,396,15,30.82,137,1,75.1,65,105,0.37,357,74,1.22,135,183,0.53,507,745,0.64,617,972,0.62,581,996,0.72,376,180,1.29,130,337,0.47,T26A5.5a,WBGene00020821,Molecule name for WBGene00020821(jhdm-1). History: N.A.
T26A5.7b,set-1,,Predicted methyltransferase (contains a SET domain) ,sRNA_DOWN in ego-1_AND_mRNA_inconsistent,Mountain 11,15,1,1.78,15,5,1.01,70,3,11.2,119,3,10.09,55,3,17.39,37,0,41.36,23,0,14.29,130,24,1.34,75,36,1.47,175,159,1.04,422,330,1.25,346,364,1.18,180,55,2.0,92,132,0.84,T26A5.7b,WBGene00004781,Molecule name for WBGene00004781(set-1). History: N.A.
T27A3.2,T27A3.2,,Ubiquitin-specific protease UBP14 ,sRNA_DOWN in ego-1_AND_mRNA_inconsistent,Mountain 5,22,1,2.56,19,1,3.8,51,3,8.2,102,6,4.95,152,3,47.5,58,0,64.21,55,0,33.35,294,59,1.25,79,70,0.8,313,182,1.62,310,338,0.9,242,406,0.74,121,73,1.02,98,96,1.23,T27A3.2,WBGene00020839,Sequence name for WBGene00020839(usp-5). History: N.A.
T27E9.7,abcf-2,,Predicted transporter (ABC superfamily) ,sRNA_DOWN in ego-1_AND_mRNA_inconsistent,Mountain 4,43,6,1.4,35,3,3.42,66,3,10.57,121,2,13.67,163,0,203.68,35,0,39.18,807,525,0.91,2278,584,0.99,1370,644,1.52,2565,1542,1.57,1111,837,1.3,886,867,1.26,685,186,2.27,302,286,1.27,T27E9.7,WBGene00012097,Sequence name for WBGene00012097(abcf-2). History: N.A.
T28A8.3,T28A8.3,,Uncharacterized protein ,sRNA_inconsistent_AND_mRNA_inconsistent,Mountain 2,46,5,1.74,34,7,1.66,55,6,5.05,128,10,3.94,99,16,7.31,46,7,6.39,22,0,13.7,40,8,1.16,40,28,1.01,96,123,0.74,347,298,1.14,267,324,1.02,202,138,0.9,101,154,0.79,T28A8.3,WBGene00012109,Public name for WBGene00012109. History: N.A.
T28A8.4,T28A8.4,,Uncharacterized protein ,sRNA_inconsistent_AND_mRNA_inconsistent,Mountain 2,37,2,2.82,19,9,0.76,65,5,6.94,188,3,15.89,85,4,21.36,21,4,4.79,12,39,0.19,5,4,0.31,68,26,1.82,88,88,0.94,173,197,0.86,136,210,0.8,90,55,1.01,46,57,0.98,T28A8.4,WBGene00012110,Public name for WBGene00012110. History: N.A.
T28A8.5,T28A8.5,,,sRNA_DOWN in ego-1_AND_mRNA_inconsistent,Mountain 2,41,0,9.35,51,7,2.47,70,10,4.07,271,18,4.81,172,31,6.71,54,13,4.28,0,0,0.6,5,2,0.51,6,6,0.71,44,10,3.85,32,67,0.48,29,70,0.52,22,9,1.42,9,11,1.01,T28A8.5,WBGene00012111,"Public name for WBGene00012111. History: Split into T28A8.8(WBGene00194852). History of WBGene00012111: Split into ""WBGene00194852"" on 2009-11-04"
T28D6.4,T28D6.4,,Ankyrin repeat ,sRNA_DOWN in ego-1_AND_mRNA_inconsistent,Mountain 1,99,5,3.71,62,10,2.17,391,15,15.46,807,22,11.81,140,25,6.74,88,10,8.81,115,0,69.08,144,38,0.95,44,31,1.0,71,112,0.6,6,27,0.25,17,17,1.24,1,5,0.21,3,4,0.97,T28D6.4,WBGene00012124,Public name for WBGene00012124. History: N.A.
T28D9.10,snr-3,"snr-3 encodes an ortholog of human small nuclear ribonucleoprotein Sm D1, a protein that forms part of a heptameric complex required for biogenesis and function of the snRNPs that catalyze mRNA splicing; in combination with the gene that encodes the human Sm D2 ortholog (snr-4), snr-3 affects embryonic viability and nuclear association and localization of P granules in embryos, based on an RNAi assay; affects embryonic and larval viability based on large-scale RNAi assays; snr-3 is expressed in embryos and adult gonads. ",Small nuclear ribonucleoprotein SMD1 and related snRNPs ,sRNA_DOWN in ego-1_AND_mRNA_inconsistent,Mountain 5,13,2,1.04,10,2,1.39,44,0,28.4,51,0,17.48,76,1,47.82,22,0,25.03,388,175,1.32,285,64,1.12,125,91,0.98,164,384,0.4,434,302,1.41,334,265,1.56,174,158,0.68,94,101,1.12,T28D9.10,WBGene00004916,Sequence name for WBGene00004916(snr-3). History: N.A.
T28D9.2a,rsp-5,,Alternative splicing factor SRp55/B52/SRp75 (RRM superfamily) ,sRNA_DOWN in ego-1_AND_mRNA_inconsistent,Mountain 18,16,2,1.26,14,4,1.14,72,6,6.58,184,1,31.1,62,2,26.08,31,0,34.83,40,92,0.26,129,53,0.61,69,59,0.83,155,237,0.62,450,243,1.81,408,252,2.0,136,62,1.34,82,80,1.24,T28D9.2a,WBGene00004702,Molecule name for WBGene00004702(rsp-5). History: N.A.
T28D9.4b,T28D9.4,,,sRNA_inconsistent_AND_mRNA_inconsistent,Mountain 3,19,8,0.49,28,9,1.1,53,7,4.26,146,4,9.89,312,45,8.45,86,7,11.84,0,0,0.6,0,3,0.06,0,9,0.07,5,3,1.41,11,36,0.32,22,40,0.69,8,3,1.39,7,11,0.8,T28D9.4b,WBGene00020896,"Molecule name for WBGene00020896(T28D9.4). History: Split into T28D9.16(WBGene00270303). History of WBGene00020896: Split into ""WBGene00270303"" on 2016-07-01"
VF13D12L.1,VF13D12L.1,"VF13D12L.1 encodes the C. elegans myo-inositol-1-phosphate (MIP) synthase ortholog; by homology, the product of VF13D12L.1 is predicted to function in de novo inositol biosynthesis by catalyzing the conversion of glucose-6-phosphate to inositol-1-phosphate; loss of VF13D12L.1 activity via RNAi has been reported to result in low levels of embryonic lethality, larval lethality, slow growth, uncoordinated locomotion, and a substantial increase in fat content; loss of VF13D12L.1 also results in a slight increase in the variability of the defecation cycle length, although this increase is not statistically significant; in situ hybridization studies reveal that VF13D12L.1 mRNA is expressed faintly in the germline. ",Myo-inositol-1-phosphate synthase ,sRNA_DOWN in ego-1_AND_mRNA_UP in ego-1,,41,0,9.35,16,1,3.23,29,1,9.47,75,5,4.26,51,3,16.15,42,0,46.8,114,84,0.81,331,113,0.74,124,127,0.7,210,344,0.58,350,429,0.8,293,473,0.77,113,74,0.94,84,122,0.83,VF13D12L.1,WBGene00012148,Sequence name for WBGene00012148(inos-1). History: N.A.
W01B11.3,nol-5,,Ribosome biogenesis protein - Nop58p/Nop5p ,sRNA_DOWN in ego-1_AND_mRNA_inconsistent,Mountain 20,52,8,1.31,52,6,2.88,124,10,7.17,203,10,6.24,203,3,63.34,74,1,40.81,953,710,0.8,1794,620,0.74,978,739,0.94,1637,2722,0.57,1897,1352,1.38,1613,1377,1.45,791,341,1.43,385,547,0.85,W01B11.3,WBGene00020915,Sequence name for WBGene00020915(nol-58). History: Renamed on 2017-08-01
W02B12.2,rsp-2,,Alternative splicing factor SRp55/B52/SRp75 (RRM superfamily) ,sRNA_DOWN in ego-1_AND_mRNA_inconsistent,Mountain 5,32,2,2.45,24,4,1.9,103,5,10.94,264,3,22.28,171,2,71.21,22,0,25.03,181,142,0.76,635,103,1.56,173,175,0.71,285,465,0.58,911,555,1.61,713,560,1.57,301,125,1.48,174,173,1.21,W02B12.2,WBGene00004699,Sequence name for WBGene00004699(rsp-2). History: N.A.
W02B12.3c,rsp-1,,Alternative splicing factor SRp55/B52/SRp75 (RRM superfamily) ,sRNA_inconsistent_AND_mRNA_inconsistent,,2,0,0.67,6,4,0.53,43,2,9.26,46,1,7.9,23,1,14.9,12,0,14.15,134,15,5.02,147,47,0.79,86,68,0.9,124,243,0.48,354,196,1.77,232,150,1.91,55,22,1.51,53,44,1.45,W02B12.3c,WBGene00004698,Molecule name for WBGene00004698(rsp-1). History: N.A.
W02C12.3b,hlh-30,"hlh-30 encodes the C. elegans ortholog of human TRANSCRIPTION FACTOR BINDING TO IGHM ENHANCER 3 (TFE3; <a href=""http://www.ncbi.nlm.nih.gov/entrez/dispomim.cgi?id=314310"">OMIM:314310</a>), that functions as a transcriptional activator of metabolic genes and which when mutated leads to disease; loss of hlh-30 activity via RNAi results in reduced fat storage; HLH-30 demonstrates sequence-specific DNA binding for the E box sequence CACGTG and likely binds DNA as a homodimer; expression profiles of hlh-30 mutants indicate that, like its human ortholog, HLH-30 regulates expression of genes involved in metabolism; an hlh-30 promoter fusion is strongly expressed in the intestine and weakly in other tissues, such as the spermatheca and vulva. ",Helix loop helix transcription factor EB ,sRNA_DOWN in ego-1_AND_mRNA_inconsistent,Mountain 1,83,0,18.7,72,2,9.24,168,6,15.24,537,2,60.3,410,4,102.09,174,9,19.05,30,10,1.68,268,77,0.88,93,42,1.56,165,99,1.56,37,33,1.1,24,45,0.67,26,3,4.17,6,13,0.6,W02C12.3b,WBGene00020930,Molecule name for WBGene00020930(hlh-30). History: N.A.
W02D3.10a,W02D3.10,,Uncharacterized conserved protein ,sRNA_DOWN in ego-1_AND_mRNA_inconsistent,Mountain 2,47,0,10.68,48,8,2.07,84,7,6.71,125,1,21.18,179,3,55.89,36,4,8.05,38,57,0.4,213,43,1.24,85,72,0.84,377,253,1.4,265,407,0.64,203,441,0.57,158,90,1.08,68,145,0.57,,,
W02D9.10,W02D9.10,,Unnamed protein ,sRNA_DOWN in ego-1_AND_mRNA_inconsistent,Mountain 15,51,4,2.31,39,0,15.19,88,4,11.23,241,3,20.34,173,5,36.02,85,9,9.36,16,0,10.12,19,14,0.34,10,14,0.52,18,59,0.3,15,19,0.78,15,8,2.2,2,1,0.93,3,1,2.41,W02D9.10,WBGene00012216,Public name for WBGene00012216. History: N.A.
W03C9.7,mex-1,"mex-1 encodes a CCCH-type zinc-finger protein that is required maternally for segregation of P granules, germ cell formation, and somatic cell differentiation in the early embryo; MEX-1 is expressed cytoplasmically in germ line blastomeres, is a component of P granules, and is required for restricting PIE-1 expression and function to these cells; mex-1 mRNA transcripts are also transiently associated with P granules. ",CCCH-type Zn-finger protein ,sRNA_DOWN in ego-1_AND_mRNA_inconsistent,Mountain 7,17,1,2.0,12,3,1.23,27,2,5.89,75,0,25.55,51,0,64.58,16,0,18.5,2,0,1.79,3,6,0.15,33,18,1.28,64,85,0.71,540,519,1.02,414,511,1.0,147,115,0.79,160,152,1.27,W03C9.7,WBGene00003228,Sequence name for WBGene00003228(mex-1). History: N.A.
W03F9.1,W03F9.1,,C4-type Zn-finger protein ,sRNA_DOWN in ego-1_AND_mRNA_inconsistent,Mountain 5,31,0,7.12,38,2,4.94,38,2,8.2,88,6,4.28,94,6,16.86,14,1,8.16,103,154,0.4,208,97,0.54,104,124,0.6,248,391,0.6,404,288,1.37,363,284,1.58,160,57,1.72,100,109,1.11,W03F9.1,WBGene00020999,Public name for WBGene00020999. History: N.A.
W03F9.5,ttb-1,,Transcription initiation factor TFIIB ,sRNA_inconsistent_AND_mRNA_inconsistent,Mountain 11,16,0,3.78,14,6,0.81,32,1,10.41,136,10,4.19,60,3,18.94,18,3,5.17,20,0,12.51,41,13,0.76,25,20,0.88,48,49,0.92,90,174,0.51,81,165,0.61,24,44,0.34,25,20,1.49,W03F9.5,WBGene00006648,Sequence name for WBGene00006648(ttb-1). History: N.A.
W03G1.6a,pig-1,"pig-1 encodes an ortholog of the human MELK serine/threonine kinase (<a href=""http://www.ncbi.nlm.nih.gov/entrez/dispomim.cgi?id=607025"">OMIM:607025</a>); PIG-1 is cytoplasmic, and is required for normal polarity in asymmetrical cell divisions yielding apoptotic cells versus neurons; whereas normal HSN/PHB and Q.p neuroblast divisions yield daughter cells that differ in size, those of pig-1 mutants are abnormally equal in size, and produce excess neurons; pig-1 acts cell-autonomously in the Q.p lineage; pig-1 is ubiquitously expressed in early embryos, broadly expressed in dividing larval cells, and silent in adults; the pig-1 phenotype is enhanced by ced-3 mutants, perhaps because mutations in pig-1 transform cell fates but fail to fully suppress apoptosis; pig-1 phenotypes are maternally rescued, probably due to pig-1 transcripts in the hermaphrodite germ line. ",,sRNA_inconsistent_AND_mRNA_inconsistent,Mountain 11,52,5,1.97,43,17,0.93,113,17,4.0,319,12,8.28,331,10,37.48,79,5,14.51,33,5,3.37,15,18,0.21,69,30,1.61,127,108,1.11,385,342,1.1,305,401,0.94,79,104,0.47,66,69,1.15,W03G1.6a,WBGene00021012,Molecule name for WBGene00021012(pig-1). History: N.A.
W03G9.2,W03G9.2,,Unnamed protein ,sRNA_DOWN in ego-1_AND_mRNA_inconsistent,Mountain 7,43,0,9.79,46,3,4.46,92,5,9.78,98,1,16.64,81,5,16.97,36,0,40.27,10,0,6.55,33,20,0.41,27,39,0.5,150,77,1.82,178,220,0.79,142,215,0.82,93,56,1.02,41,73,0.68,W03G9.2,WBGene00021014,Sequence name for WBGene00021014(pid-4). History: N.A.
W03G9.4,app-1,,Xaa-Pro aminopeptidase ,sRNA_DOWN in ego-1_AND_mRNA_inconsistent,Mountain 11,18,0,4.23,25,0,9.87,36,2,7.78,48,1,8.24,142,3,44.4,27,0,30.47,111,99,0.67,389,107,0.92,164,172,0.68,489,635,0.73,813,543,1.47,652,649,1.24,244,120,1.25,152,165,1.11,W03G9.4,WBGene00000155,Sequence name for WBGene00000155(app-1). History: N.A.
W04A8.7,taf-1,The taf-1 gene encodes an ortholog of human TATA-binding protein associated factor TAF1L (TAFII250) that possesses histone acetyl transferase (HAT) activity and is a component of the TFIID general transcription factor that recognizes the transcription start site; TAF-1 is required for proper embryonic and larval development. ,,sRNA_DOWN in ego-1_AND_mRNA_inconsistent,Mountain 2,40,0,9.13,43,5,2.78,88,8,6.24,145,14,3.27,157,23,8.18,32,8,3.99,119,104,0.68,346,110,0.8,91,97,0.67,446,407,1.03,492,378,1.28,393,445,1.09,268,160,1.03,121,169,0.87,W04A8.7,WBGene00006382,Sequence name for WBGene00006382(taf-1). History: N.A.
W05B10.1,his-74,,Histones H3 and H4 ,sRNA_DOWN in ego-1_AND_mRNA_inconsistent,Mountain 7,27,0,6.23,22,3,2.18,50,0,32.18,214,0,72.29,99,0,124.2,52,9,5.77,1,0,1.19,17,14,0.31,15,18,0.6,106,47,2.1,137,250,0.54,105,273,0.48,51,52,0.61,74,35,2.51,W05B10.1,WBGene00012276,Sequence name for WBGene00012276(his-74). History: N.A.
W05F2.6,W05F2.6,,,sRNA_inconsistent_AND_mRNA_inconsistent,Mountain 7,18,0,4.23,13,0,5.32,48,2,10.31,34,0,11.77,68,1,42.85,26,0,29.39,2,0,1.79,11,6,0.44,49,60,0.58,102,156,0.62,322,438,0.72,262,437,0.74,123,74,1.02,92,120,0.93,W05F2.6,WBGene00021038,Public name for WBGene00021038. History: N.A.
W05G11.2,W05G11.2,,,sRNA_DOWN in ego-1_AND_mRNA_inconsistent,Mountain 28,93,6,2.99,123,17,2.62,195,19,6.18,424,23,5.95,138,32,5.23,17,0,19.59,0,0,0.6,5,0,1.53,0,0,0.71,0,2,0.31,1,3,0.49,0,3,0.31,1,0,1.24,1,2,0.8,W05G11.2,WBGene00021040,Public name for WBGene00021040. History: N.A.
W06D4.6,rad-54,"rad-54 is orthologous to the human gene RAD54 (RAD54L; <a href=""http://www.ncbi.nlm.nih.gov/entrez/dispomim.cgi?id=603615"">OMIM:603615</a>), which when mutated leads to disease. ","DNA repair protein, SNF2 family ",sRNA_DOWN in ego-1_AND_mRNA_inconsistent,Mountain 9,26,4,1.2,30,6,1.68,55,5,5.89,113,7,4.79,161,0,201.2,60,2,22.13,7,0,4.76,26,6,0.98,29,17,1.19,96,76,1.19,104,163,0.63,101,193,0.65,48,31,0.95,21,45,0.58,W06D4.6,WBGene00004298,Sequence name for WBGene00004298(rad-54.L). History: Renamed on 2019-07-04
W06H8.8d,ttn-1,"ttn-1, through multiple splicing, encodes at least six protein isoforms that are orthologs of titin (<a href=""http://www.ncbi.nlm.nih.gov/entrez/dispomim.cgi?id=188840"">OMIM:188840</a>, mutated in cardiomyopathy or tibial muscular dystrophy), with the three largest isoforms being 2.2 MDa, 1.2 MDa and 301 kDa; TTN-1 isoforms are expressed in body wall and vulval muscle, localized to the centers of I-bands, with the two largest isoforms expressed in all muscles except pharyngeal; the largest TTN-1 isoform contains 56 Ig domains, 11 FnIII domains, a twitchin-like protein kinase domain, a domain similar to the elastic PEVK domain of vertebrate titin, 96 tandem copies of a 16-residue motif predicted to comprise a coiled-coil domain, and two other short multiply repeated motifs; the TTN-1 kinase domain is catalytically active, and its activity is quantitatively regulated by alternative splicing of an adjacent autoinhibitory domain; TTN-1 is mislocalized in an alpha-actinin mutant (atn-1[ok84]); ttn-1 is transcribed from at least two promoters, and its transcription is stimulated by NFI-1. ",,sRNA_DOWN in ego-1_AND_mRNA_inconsistent,Mountain 1,610,3,34.0,618,132,1.77,1682,146,7.23,456,47,3.2,175,28,7.54,12,0,14.15,1863,6972,0.16,17231,10740,0.41,3715,6959,0.38,11146,10049,1.04,423,1016,0.41,473,1030,0.57,1034,1185,0.54,245,788,0.38,W06H8.8d,WBGene00006436,Molecule name for WBGene00006436(ttn-1). History: Renamed on 2005-12-13
W07B3.2d,gei-4,"gei-4 encodes a protein with a coiled-coil domain (predicted to mediate protein-protein interactions), an internal repeat of 69 residues (covering residues 134-202, 203-265, and 266-328 of W07B3.2a), and a glutamine/asparagine-rich domain; GEI-4 is paralogous to Y50D7A.8 and Y59C2A.3, physically interacts with GEX-2, and is required for embryonic viability, fertility, and vulval morphogenesis; GEI-4 is claimed to have weak homology to trichohyalin, a mammalian intermediate filament interacting protein; the similarity of the mutant phenotypes of gei-4, gex-2 and gex-3 and their interaction sugggest that the GEX-2/GEX-3/GEI-4 protein complex is essential for the regulation of intermediate filaments during rearrangement of the cytoskeleton that occurs in embryogenesis; GFI-2, an ankyrin-repeat protein associates with GEI-4 and exhibits a similar mutant phenotype, suggesting that gfi-2 is also involved in intermediate filament dynamics. ",Unnamed protein ,sRNA_inconsistent_AND_mRNA_inconsistent,,9,4,0.45,25,0,9.87,29,1,9.47,47,3,4.03,70,12,6.78,18,1,10.34,421,259,0.97,949,111,2.16,319,119,1.9,316,422,0.71,564,287,1.92,488,274,2.2,204,103,1.22,72,169,0.52,W07B3.2d,WBGene00001561,Molecule name for WBGene00001561(gei-4). History: N.A.
W07E6.1,nol-1,,tRNA and rRNA cytosine-C5-methylase (nucleolar protein NOL1/NOP2) ,sRNA_DOWN in ego-1_AND_mRNA_inconsistent,Mountain 5,47,0,10.68,38,2,4.94,47,6,4.33,56,3,4.79,146,9,18.26,39,5,7.26,208,149,0.83,316,169,0.48,190,165,0.82,542,659,0.77,295,267,1.08,226,305,0.92,138,69,1.23,70,80,1.06,W07E6.1,WBGene00021073,Sequence name for WBGene00021073(nsun-1). History: Renamed on 2017-08-01; Renamed on 2020-06-01
W07E6.2,W07E6.2,"W07E6.2 encodes an ortholog of S. cerevisiae RSA4 that may suppress tumorous growth in the germ line by ensuring robust larval germline proliferation; like PRO-1, -2, and -3, W07E6.2 is probably required for ribosome biogenesis, suggesting a link between biogenesis in the distal sheath and control of cell division in the germ line. ",Notchless-like WD40 repeat-containing protein ,sRNA_DOWN in ego-1_AND_mRNA_inconsistent,Mountain 5,21,1,2.45,19,1,3.8,42,3,6.78,67,2,7.62,89,10,10.16,33,0,37.0,84,18,2.66,162,70,0.59,147,87,1.2,192,258,0.7,133,143,0.91,142,150,1.17,47,29,0.99,34,30,1.36,W07E6.2,WBGene00021074,Public name for WBGene00021074. History: N.A.
W07E6.4,prp-21,,"Splicing factor 3a, subunit 1 ",sRNA_DOWN in ego-1_AND_mRNA_inconsistent,Mountain 5,19,0,4.45,26,9,1.03,62,6,5.68,54,1,9.25,113,1,70.79,32,0,35.92,166,122,0.81,224,57,0.99,121,75,1.14,366,338,1.02,489,253,1.89,343,185,2.29,174,48,2.21,99,82,1.45,W07E6.4,WBGene00004188,Sequence name for WBGene00004188(prp-21). History: N.A.
W08D2.7,mtr-4,,"Nuclear exosomal RNA helicase MTR4, DEAD-box superfamily ",sRNA_DOWN in ego-1_AND_mRNA_inconsistent,Mountain 5,34,0,7.79,32,4,2.51,44,5,4.73,73,6,3.55,99,4,24.84,39,0,43.53,156,104,0.89,344,95,0.92,179,109,1.17,611,412,1.39,557,482,1.13,452,537,1.04,193,117,1.02,115,154,0.9,W08D2.7,WBGene00012342,Sequence name for WBGene00012342(mtr-4). History: N.A.
W08E3.1,snr-2,,U1 snRNP component ,sRNA_DOWN in ego-1_AND_mRNA_inconsistent,Mountain 18,11,0,2.67,20,0,7.97,34,1,11.04,71,0,24.21,134,1,83.83,19,2,7.26,292,155,1.12,309,96,0.81,148,135,0.78,193,558,0.33,819,487,1.65,630,461,1.69,300,276,0.67,223,270,1.0,W08E3.1,WBGene00004915,Sequence name for WBGene00004915(snr-2). History: N.A.
W08E3.3,tag-210,,Predicted GTP-binding protein (ODN superfamily) ,sRNA_DOWN in ego-1_AND_mRNA_inconsistent,Mountain 2,18,3,1.06,19,1,3.8,64,1,20.51,38,1,6.56,37,1,23.6,19,0,21.77,1040,343,1.8,2147,315,1.73,656,453,1.03,1461,1743,0.79,1231,892,1.35,1006,923,1.35,440,175,1.55,311,346,1.08,W08E3.3,WBGene00012344,Sequence name for WBGene00012344(ola-1). History: Renamed on 2012-12-21
W08F4.8b,cdc-37,,"Cell division cycle 37 protein, CDC37 ",sRNA_DOWN in ego-1_AND_mRNA_inconsistent,Mountain 1,24,0,5.56,24,3,2.37,60,3,9.62,84,1,14.29,100,3,31.36,29,6,4.66,359,244,0.87,660,119,1.4,261,173,1.07,316,643,0.46,1005,588,1.67,805,554,1.8,378,276,0.85,239,302,0.96,W08F4.8b,WBGene00021097,Molecule name for WBGene00021097(cdc-37). History: N.A.
W08G11.4,pptr-1,,"Serine/threonine protein phosphatase 2A, regulatory subunit ",sRNA_DOWN in ego-1_AND_mRNA_inconsistent,Mountain 1,19,3,1.11,30,8,1.31,57,11,3.05,132,3,11.18,146,5,30.43,57,3,15.78,214,86,1.47,395,80,1.25,306,134,1.62,592,315,1.77,208,345,0.59,192,346,0.69,69,59,0.72,42,65,0.79,W08G11.4,WBGene00012348,Sequence name for WBGene00012348(pptr-1). History: N.A.
W09C5.2,unc-59,"unc-59, by alternative splicing, encodes two septin isoforms required (like the septins UNC-61A/B) for normal axonal migration, distal tip cell migration, and postembryonic cytokinesis (at the cellular level) and for normal locomotion and formation of the postembryonic vulva, somatic gonad, and male tail (at the organismal level); both UNC-59 and UNC-61A/B are dispensable for embryonic cytokinesis and development, but are thought to be required for all postembryonic cytokinesis; UNC-59 and UNC-61A/B depend on each other for localization to the cytokinetic furrow. ",Septin family protein (P-loop GTPase) ,sRNA_DOWN in ego-1_AND_mRNA_inconsistent,Mountain 7,27,2,2.08,26,6,1.46,68,7,5.44,119,5,6.72,226,6,40.27,74,3,20.41,16,22,0.44,100,16,1.51,50,40,0.89,131,93,1.32,332,235,1.38,309,299,1.28,187,65,1.76,107,94,1.37,W09C5.2,WBGene00006793,Sequence name for WBGene00006793(unc-59). History: N.A.
